{"$defs":{"config":{"additionalProperties":false,"properties":{"architectures":{"const":["LlamaForCausalLM"]},"bos_token_id":{"const":0},"eos_token_id":{"const":0},"hidden_size":{"const":576},"intermediate_size":{"const":1536},"max_position_embeddings":{"const":8192},"model_type":{"const":"llama"},"num_attention_heads":{"const":9},"num_hidden_layers":{"const":30},"num_key_value_heads":{"const":3},"tie_word_embeddings":{"const":true},"vocab_size":{"const":49152}},"required":["architectures","bos_token_id","eos_token_id","hidden_size","intermediate_size","max_position_embeddings","model_type","num_attention_heads","num_hidden_layers","num_key_value_heads","tie_word_embeddings","vocab_size"],"type":"object"},"observation":{"additionalProperties":false,"properties":{"alias_group_count":{"const":272},"alias_record_sha256":{"const":"8efcc3120c19a1a0784811d4ae95d327849ad8e7bd9176d45c3a6b9b7f067a84"},"base_state_sha256":{"const":"ce7e8dd6a97ac4cc56bf4f1e38625817386e27af58f1ed63377741f7f2aab1ba"},"config_identity":{"$ref":"#/$defs/config"},"dtype":{"const":"torch.bfloat16"},"encoded_byte_length":{"const":325706271},"entry_count":{"const":273},"parameter_count":{"const":134515008},"runtime":{"additionalProperties":false,"properties":{"python":{"const":"3.12.13"},"torch":{"const":"2.14.0+cu130"},"transformers":{"const":"5.17.0"}},"required":["python","torch","transformers"],"type":"object"},"trainable_parameter_count":{"const":0},"training":{"const":false}},"required":["alias_group_count","alias_record_sha256","base_state_sha256","config_identity","dtype","encoded_byte_length","entry_count","parameter_count","runtime","trainable_parameter_count","training"],"type":"object"}},"$id":"https://aluclu.org/schemas/alc_r0/v1/base-digest-receipt.schema.json","$schema":"https://json-schema.org/draft/2020-12/schema","additionalProperties":false,"properties":{"acquisition_receipt_sha256":{"const":"2a4baddc2bb8451811e199e7dd6f91512fad73d367083c833e117c3e4d09984a"},"experiment_id":{"const":"alc-r0-smollm2-135m-v1"},"fresh_process_reproducible":{"const":true},"lock_manifest_sha256":{"const":"1756f42033d4de2f5d2944fc7a95a4e324665a26f54c0679bb757658fc91abaf"},"observations":{"items":false,"maxItems":2,"minItems":2,"prefixItems":[{"$ref":"#/$defs/observation"},{"$ref":"#/$defs/observation"}],"type":"array"},"process_count":{"const":2},"schema_id":{"const":"https://aluclu.org/schemas/alc_r0/v1/base-digest-receipt.schema.json"},"schema_version":{"const":1},"source_commit":{"pattern":"^[0-9a-f]{40}$","type":"string"},"training_authority":{"const":false},"windows_lock_sha256":{"const":"a7a921f7b095b0329fbb7df6a25612c6e8a1f160122f853a6a159d8478946615"}},"required":["acquisition_receipt_sha256","experiment_id","fresh_process_reproducible","lock_manifest_sha256","observations","process_count","schema_id","schema_version","source_commit","training_authority","windows_lock_sha256"],"title":"ALC-R0 v1 fresh-process base digest receipt","type":"object"}