{"acquisition_receipt_sha256":"2a4baddc2bb8451811e199e7dd6f91512fad73d367083c833e117c3e4d09984a","experiment_id":"alc-r0-smollm2-135m-v1","fresh_process_reproducible":true,"lock_manifest_sha256":"1756f42033d4de2f5d2944fc7a95a4e324665a26f54c0679bb757658fc91abaf","observations":[{"alias_group_count":272,"alias_record_sha256":"8efcc3120c19a1a0784811d4ae95d327849ad8e7bd9176d45c3a6b9b7f067a84","base_state_sha256":"ce7e8dd6a97ac4cc56bf4f1e38625817386e27af58f1ed63377741f7f2aab1ba","config_identity":{"architectures":["LlamaForCausalLM"],"bos_token_id":0,"eos_token_id":0,"hidden_size":576,"intermediate_size":1536,"max_position_embeddings":8192,"model_type":"llama","num_attention_heads":9,"num_hidden_layers":30,"num_key_value_heads":3,"tie_word_embeddings":true,"vocab_size":49152},"dtype":"torch.bfloat16","encoded_byte_length":325706271,"entry_count":273,"parameter_count":134515008,"runtime":{"python":"3.12.13","torch":"2.14.0+cu130","transformers":"5.17.0"},"trainable_parameter_count":0,"training":false},{"alias_group_count":272,"alias_record_sha256":"8efcc3120c19a1a0784811d4ae95d327849ad8e7bd9176d45c3a6b9b7f067a84","base_state_sha256":"ce7e8dd6a97ac4cc56bf4f1e38625817386e27af58f1ed63377741f7f2aab1ba","config_identity":{"architectures":["LlamaForCausalLM"],"bos_token_id":0,"eos_token_id":0,"hidden_size":576,"intermediate_size":1536,"max_position_embeddings":8192,"model_type":"llama","num_attention_heads":9,"num_hidden_layers":30,"num_key_value_heads":3,"tie_word_embeddings":true,"vocab_size":49152},"dtype":"torch.bfloat16","encoded_byte_length":325706271,"entry_count":273,"parameter_count":134515008,"runtime":{"python":"3.12.13","torch":"2.14.0+cu130","transformers":"5.17.0"},"trainable_parameter_count":0,"training":false}],"process_count":2,"schema_id":"https://aluclu.org/schemas/alc_r0/v1/base-digest-receipt.schema.json","schema_version":1,"source_commit":"4efd7d5a1958abacea93a4bac664c0674cd678b8","training_authority":false,"windows_lock_sha256":"a7a921f7b095b0329fbb7df6a25612c6e8a1f160122f853a6a159d8478946615"}